{
  "$schema": "https://json-schema.org/draft/2020-12/schema",
  "$comment": "Generated by `bluebird schemas`. Do not edit by hand.",
  "$defs": {
    "DiamondStatusItem": {
      "additionalProperties": false,
      "description": "State of one source (bronze) or one transformation (silver).",
      "properties": {
        "id": {
          "description": "Source id from config/sources.yaml.",
          "title": "Id",
          "type": "string"
        },
        "dataset": {
          "anyOf": [
            {
              "type": "string"
            },
            {
              "type": "null"
            }
          ],
          "description": "Silver dataset produced (transformations only).",
          "title": "Dataset"
        },
        "state": {
          "enum": [
            "ok",
            "partial",
            "stale",
            "down"
          ],
          "title": "State",
          "type": "string"
        },
        "ok": {
          "anyOf": [
            {
              "type": "integer"
            },
            {
              "type": "null"
            }
          ],
          "description": "Stations with data, when known.",
          "title": "Ok"
        },
        "expected": {
          "anyOf": [
            {
              "type": "integer"
            },
            {
              "type": "null"
            }
          ],
          "title": "Expected"
        }
      },
      "required": [
        "id",
        "dataset",
        "state",
        "ok",
        "expected"
      ],
      "title": "DiamondStatusItem",
      "type": "object"
    },
    "DiamondStatusKpi": {
      "additionalProperties": false,
      "properties": {
        "id": {
          "description": "KPI id from config/kpis.yaml.",
          "title": "Id",
          "type": "string"
        },
        "state": {
          "description": "Most degraded state of its periods.",
          "enum": [
            "ok",
            "partial",
            "stale",
            "down"
          ],
          "title": "State",
          "type": "string"
        },
        "periods": {
          "items": {
            "$ref": "#/$defs/DiamondStatusPeriod"
          },
          "title": "Periods",
          "type": "array"
        }
      },
      "required": [
        "id",
        "state",
        "periods"
      ],
      "title": "DiamondStatusKpi",
      "type": "object"
    },
    "DiamondStatusPeriod": {
      "additionalProperties": false,
      "description": "State of one KPI, or one tile, for one period of one ski day.",
      "properties": {
        "key": {
          "title": "Key",
          "type": "string"
        },
        "period_id": {
          "title": "Period Id",
          "type": "string"
        },
        "ski_day": {
          "format": "date",
          "title": "Ski Day",
          "type": "string"
        },
        "start": {
          "description": "Local time, with UTC offset.",
          "format": "date-time",
          "title": "Start",
          "type": "string"
        },
        "end": {
          "description": "Local time, with UTC offset. Over afterwards.",
          "format": "date-time",
          "title": "End",
          "type": "string"
        },
        "state": {
          "enum": [
            "ok",
            "partial",
            "stale",
            "down"
          ],
          "title": "State",
          "type": "string"
        },
        "ok": {
          "description": "Stations with a value.",
          "title": "Ok",
          "type": "integer"
        },
        "expected": {
          "title": "Expected",
          "type": "integer"
        },
        "updated_at": {
          "anyOf": [
            {
              "format": "date-time",
              "type": "string"
            },
            {
              "type": "null"
            }
          ],
          "description": "When the values shown were computed.",
          "title": "Updated At"
        }
      },
      "required": [
        "key",
        "period_id",
        "ski_day",
        "start",
        "end",
        "state",
        "ok",
        "expected",
        "updated_at"
      ],
      "title": "DiamondStatusPeriod",
      "type": "object"
    },
    "DiamondStatusTile": {
      "additionalProperties": false,
      "properties": {
        "tile_id": {
          "description": "Tile id from config/tiles.yaml.",
          "title": "Tile Id",
          "type": "string"
        },
        "period": {
          "$ref": "#/$defs/DiamondStatusPeriod"
        }
      },
      "required": [
        "tile_id",
        "period"
      ],
      "title": "DiamondStatusTile",
      "type": "object"
    }
  },
  "additionalProperties": false,
  "description": "``diamond/status.json``: health of the last refresh, shown in the site footer.",
  "properties": {
    "schema_version": {
      "const": 1,
      "default": 1,
      "title": "Schema Version",
      "type": "integer"
    },
    "generated_at": {
      "description": "Start of the refresh.",
      "format": "date-time",
      "title": "Generated At",
      "type": "string"
    },
    "run_id": {
      "title": "Run Id",
      "type": "string"
    },
    "ski_day": {
      "format": "date",
      "title": "Ski Day",
      "type": "string"
    },
    "state": {
      "description": "Most degraded state of everything below.",
      "enum": [
        "ok",
        "partial",
        "stale",
        "down"
      ],
      "title": "State",
      "type": "string"
    },
    "sources": {
      "items": {
        "$ref": "#/$defs/DiamondStatusItem"
      },
      "title": "Sources",
      "type": "array"
    },
    "transforms": {
      "items": {
        "$ref": "#/$defs/DiamondStatusItem"
      },
      "title": "Transforms",
      "type": "array"
    },
    "kpis": {
      "items": {
        "$ref": "#/$defs/DiamondStatusKpi"
      },
      "title": "Kpis",
      "type": "array"
    },
    "tiles": {
      "additionalProperties": {
        "items": {
          "$ref": "#/$defs/DiamondStatusTile"
        },
        "type": "array"
      },
      "description": "Per massif id.",
      "title": "Tiles",
      "type": "object"
    }
  },
  "required": [
    "generated_at",
    "run_id",
    "ski_day",
    "state",
    "sources",
    "transforms",
    "kpis",
    "tiles"
  ],
  "title": "DiamondStatus",
  "type": "object"
}
