{"schema_version":1,"generated_at":"2026-10-04T18:56:24Z","run_id":"20261004T185624Z","ski_day":"2026-10-04","state":"ok","sources":[{"id":"open_meteo_ensemble","dataset":null,"state":"ok","ok":null,"expected":null},{"id":"open_meteo_forecast","dataset":null,"state":"ok","ok":null,"expected":null}],"transforms":[{"id":"open_meteo_ensemble","dataset":"ensemble_hourly","state":"ok","ok":18,"expected":18},{"id":"open_meteo_forecast","dataset":"forecast_hourly","state":"ok","ok":18,"expected":18}],"kpis":[{"id":"snowfall_chance","state":"ok","periods":[{"key":"evening@2026-10-04","period_id":"evening","ski_day":"2026-10-04","start":"2026-10-04T18:00:00+02:00","end":"2026-10-05T00:00:00+02:00","state":"ok","ok":18,"expected":18,"updated_at":"2026-10-04T18:56:24Z"},{"key":"night@2026-10-04","period_id":"night","ski_day":"2026-10-04","start":"2026-10-05T00:00:00+02:00","end":"2026-10-05T06:00:00+02:00","state":"ok","ok":18,"expected":18,"updated_at":"2026-10-04T18:56:24Z"},{"key":"day@2026-10-05","period_id":"day","ski_day":"2026-10-05","start":"2026-10-05T06:00:00+02:00","end":"2026-10-05T18:00:00+02:00","state":"ok","ok":18,"expected":18,"updated_at":"2026-10-04T18:56:24Z"},{"key":"morning@2026-10-05","period_id":"morning","ski_day":"2026-10-05","start":"2026-10-05T06:00:00+02:00","end":"2026-10-05T12:00:00+02:00","state":"ok","ok":18,"expected":18,"updated_at":"2026-10-04T18:56:24Z"},{"key":"midday@2026-10-05","period_id":"midday","ski_day":"2026-10-05","start":"2026-10-05T12:00:00+02:00","end":"2026-10-05T14:00:00+02:00","state":"ok","ok":18,"expected":18,"updated_at":"2026-10-04T18:56:24Z"},{"key":"afternoon@2026-10-05","period_id":"afternoon","ski_day":"2026-10-05","start":"2026-10-05T14:00:00+02:00","end":"2026-10-05T18:00:00+02:00","state":"ok","ok":18,"expected":18,"updated_at":"2026-10-04T18:56:24Z"},{"key":"evening@2026-10-05","period_id":"evening","ski_day":"2026-10-05","start":"2026-10-05T18:00:00+02:00","end":"2026-10-06T00:00:00+02:00","state":"ok","ok":18,"expected":18,"updated_at":"2026-10-04T18:56:24Z"},{"key":"night@2026-10-05","period_id":"night","ski_day":"2026-10-05","start":"2026-10-06T00:00:00+02:00","end":"2026-10-06T06:00:00+02:00","state":"ok","ok":18,"expected":18,"updated_at":"2026-10-04T18:56:24Z"}]},{"id":"offpiste_powder_chance","state":"ok","periods":[{"key":"morning@2026-10-05","period_id":"morning","ski_day":"2026-10-05","start":"2026-10-05T06:00:00+02:00","end":"2026-10-05T12:00:00+02:00","state":"ok","ok":18,"expected":18,"updated_at":"2026-10-04T18:56:24Z"},{"key":"midday@2026-10-05","period_id":"midday","ski_day":"2026-10-05","start":"2026-10-05T12:00:00+02:00","end":"2026-10-05T14:00:00+02:00","state":"ok","ok":18,"expected":18,"updated_at":"2026-10-04T18:56:24Z"},{"key":"afternoon@2026-10-05","period_id":"afternoon","ski_day":"2026-10-05","start":"2026-10-05T14:00:00+02:00","end":"2026-10-05T18:00:00+02:00","state":"ok","ok":18,"expected":18,"updated_at":"2026-10-04T18:56:24Z"}]},{"id":"onpiste_powder_chance","state":"ok","periods":[{"key":"morning@2026-10-05","period_id":"morning","ski_day":"2026-10-05","start":"2026-10-05T06:00:00+02:00","end":"2026-10-05T12:00:00+02:00","state":"ok","ok":18,"expected":18,"updated_at":"2026-10-04T18:56:24Z"},{"key":"midday@2026-10-05","period_id":"midday","ski_day":"2026-10-05","start":"2026-10-05T12:00:00+02:00","end":"2026-10-05T14:00:00+02:00","state":"ok","ok":18,"expected":18,"updated_at":"2026-10-04T18:56:24Z"},{"key":"afternoon@2026-10-05","period_id":"afternoon","ski_day":"2026-10-05","start":"2026-10-05T14:00:00+02:00","end":"2026-10-05T18:00:00+02:00","state":"ok","ok":18,"expected":18,"updated_at":"2026-10-04T18:56:24Z"}]},{"id":"whiteout_chance","state":"ok","periods":[{"key":"day@2026-10-05","period_id":"day","ski_day":"2026-10-05","start":"2026-10-05T06:00:00+02:00","end":"2026-10-05T18:00:00+02:00","state":"ok","ok":18,"expected":18,"updated_at":"2026-10-04T18:56:24Z"}]}],"tiles":{"pyrenees":[{"tile_id":"snowfall_today","period":{"key":"evening@2026-10-04","period_id":"evening","ski_day":"2026-10-04","start":"2026-10-04T18:00:00+02:00","end":"2026-10-05T00:00:00+02:00","state":"ok","ok":18,"expected":18,"updated_at":"2026-10-04T18:56:24Z"}},{"tile_id":"snowfall_today","period":{"key":"night@2026-10-04","period_id":"night","ski_day":"2026-10-04","start":"2026-10-05T00:00:00+02:00","end":"2026-10-05T06:00:00+02:00","state":"ok","ok":18,"expected":18,"updated_at":"2026-10-04T18:56:24Z"}},{"tile_id":"snowfall_today","period":{"key":"day@2026-10-05","period_id":"day","ski_day":"2026-10-05","start":"2026-10-05T06:00:00+02:00","end":"2026-10-05T18:00:00+02:00","state":"ok","ok":18,"expected":18,"updated_at":"2026-10-04T18:56:24Z"}},{"tile_id":"snowfall_today","period":{"key":"morning@2026-10-05","period_id":"morning","ski_day":"2026-10-05","start":"2026-10-05T06:00:00+02:00","end":"2026-10-05T12:00:00+02:00","state":"ok","ok":18,"expected":18,"updated_at":"2026-10-04T18:56:24Z"}},{"tile_id":"snowfall_today","period":{"key":"midday@2026-10-05","period_id":"midday","ski_day":"2026-10-05","start":"2026-10-05T12:00:00+02:00","end":"2026-10-05T14:00:00+02:00","state":"ok","ok":18,"expected":18,"updated_at":"2026-10-04T18:56:24Z"}},{"tile_id":"snowfall_today","period":{"key":"afternoon@2026-10-05","period_id":"afternoon","ski_day":"2026-10-05","start":"2026-10-05T14:00:00+02:00","end":"2026-10-05T18:00:00+02:00","state":"ok","ok":18,"expected":18,"updated_at":"2026-10-04T18:56:24Z"}},{"tile_id":"snowfall_today","period":{"key":"evening@2026-10-05","period_id":"evening","ski_day":"2026-10-05","start":"2026-10-05T18:00:00+02:00","end":"2026-10-06T00:00:00+02:00","state":"ok","ok":18,"expected":18,"updated_at":"2026-10-04T18:56:24Z"}},{"tile_id":"snowfall_today","period":{"key":"night@2026-10-05","period_id":"night","ski_day":"2026-10-05","start":"2026-10-06T00:00:00+02:00","end":"2026-10-06T06:00:00+02:00","state":"ok","ok":18,"expected":18,"updated_at":"2026-10-04T18:56:24Z"}},{"tile_id":"onpiste_powder","period":{"key":"morning@2026-10-05","period_id":"morning","ski_day":"2026-10-05","start":"2026-10-05T06:00:00+02:00","end":"2026-10-05T12:00:00+02:00","state":"ok","ok":18,"expected":18,"updated_at":"2026-10-04T18:56:24Z"}},{"tile_id":"onpiste_powder","period":{"key":"midday@2026-10-05","period_id":"midday","ski_day":"2026-10-05","start":"2026-10-05T12:00:00+02:00","end":"2026-10-05T14:00:00+02:00","state":"ok","ok":18,"expected":18,"updated_at":"2026-10-04T18:56:24Z"}},{"tile_id":"onpiste_powder","period":{"key":"afternoon@2026-10-05","period_id":"afternoon","ski_day":"2026-10-05","start":"2026-10-05T14:00:00+02:00","end":"2026-10-05T18:00:00+02:00","state":"ok","ok":18,"expected":18,"updated_at":"2026-10-04T18:56:24Z"}},{"tile_id":"offpiste_powder","period":{"key":"morning@2026-10-05","period_id":"morning","ski_day":"2026-10-05","start":"2026-10-05T06:00:00+02:00","end":"2026-10-05T12:00:00+02:00","state":"ok","ok":18,"expected":18,"updated_at":"2026-10-04T18:56:24Z"}},{"tile_id":"offpiste_powder","period":{"key":"midday@2026-10-05","period_id":"midday","ski_day":"2026-10-05","start":"2026-10-05T12:00:00+02:00","end":"2026-10-05T14:00:00+02:00","state":"ok","ok":18,"expected":18,"updated_at":"2026-10-04T18:56:24Z"}},{"tile_id":"offpiste_powder","period":{"key":"afternoon@2026-10-05","period_id":"afternoon","ski_day":"2026-10-05","start":"2026-10-05T14:00:00+02:00","end":"2026-10-05T18:00:00+02:00","state":"ok","ok":18,"expected":18,"updated_at":"2026-10-04T18:56:24Z"}},{"tile_id":"whiteout","period":{"key":"day@2026-10-05","period_id":"day","ski_day":"2026-10-05","start":"2026-10-05T06:00:00+02:00","end":"2026-10-05T18:00:00+02:00","state":"ok","ok":18,"expected":18,"updated_at":"2026-10-04T18:56:24Z"}}]}}
